{
  "profile_growth_batch_proposal": "vouch.profile-growth-batch-proposal/v0",
  "scope": "W4.7-L2-batch-proposal-after-M2-evidence",
  "version": "1.3.11",
  "generator": {
    "script": "scripts/check-profile-growth-batch-proposal.mjs",
    "mode": "m2-zero-admission-profile-growth-batch",
    "inputs": [
      "manifests/profile-lane-governance.v0.json",
      "manifests/out-of-profile-ledger.v0.json",
      "manifests/transcription-fidelity-ledger.v0.json",
      "manifests/transcription-complexity-metrics.v0.json",
      "manifests/writer-contract-audit.v0.json",
      "manifests/writer-matrix.v0.json"
    ]
  },
  "source_manifests": [
    {
      "path": "manifests/profile-lane-governance.v0.json",
      "sha256": "9b7056251ebe13d586b3f43a410400cbae81bfe5a7284f4b7bbd04bf32587a37",
      "tag": "vouch.profile-lane-governance/v0"
    },
    {
      "path": "manifests/out-of-profile-ledger.v0.json",
      "sha256": "69ed1583c76294b4f64dab484c6c2783d75b3946a9d8ae6eb4dba403c6d6a531",
      "tag": "vouch.out-of-profile-ledger/v0"
    },
    {
      "path": "manifests/transcription-fidelity-ledger.v0.json",
      "sha256": "519fcba726ad36efe6b767bc6dce40148a0cece79a02ee2a446eefa549ce548f",
      "tag": "vouch.transcription-fidelity-ledger/v0"
    },
    {
      "path": "manifests/transcription-complexity-metrics.v0.json",
      "sha256": "7e20f1a3062d5303b4763e38a3c72ca801ef60de21a5ba42a7b325a48576f9c5",
      "tag": "vouch.transcription-complexity-metrics/v0"
    },
    {
      "path": "manifests/writer-contract-audit.v0.json",
      "sha256": "ff065317e35059948ccad2ba3d7462023c5f8eb7633bd3f688c085f25971c47e",
      "tag": "vouch.writer-contract-audit/v0"
    },
    {
      "path": "manifests/writer-matrix.v0.json",
      "sha256": "aed70b116eaa216aa3d100c8ede84f96f87672ca16151b910348b3106edc18a0",
      "tag": "vouch.writer-matrix/v0"
    }
  ],
  "evidence_summary": {
    "m2_case_count": 676,
    "m2_rule_count": 5,
    "observed_out_of_profile_case_count": 0,
    "demand_gated_with_evidence_count": 0,
    "profile_expansions_recommended": 0,
    "l2_promotion_supported_count": 0,
    "l3_promotion_supported_count": 0,
    "active_l2_candidate_count": 0,
    "native_read_side_canonical_acceptance": "active",
    "bridge_read_side_canonical_acceptance": "active"
  },
  "proposal": {
    "batch_id": "W4.7-M2-zero-admission",
    "profile_version_change": false,
    "proposed_l2_changes": [],
    "proposed_l3_changes": [],
    "proposed_profile_expansions": [],
    "l2_candidates_reviewed": [],
    "demand_gated_candidates": [
      {
        "candidate_id": "letrec",
        "lane": "demand-gated",
        "evidence_count": 0,
        "promotion_supported": false,
        "disposition": "parked-no-m2-out-of-profile-evidence"
      },
      {
        "candidate_id": "bounded-vectors",
        "lane": "demand-gated",
        "evidence_count": 0,
        "promotion_supported": false,
        "disposition": "parked-no-m2-out-of-profile-evidence"
      }
    ],
    "disposition": "no-l2-l3-batch-admitted-current-m2-evidence-keeps-profile-v0",
    "next_required_slice": "post-W4.7-reduced-origin-foundation-no-profile-expansion"
  },
  "negative_checks": [
    "reject-observed-out-of-profile-evidence-injection",
    "reject-demand-gated-evidence-injection",
    "reject-positive-l2-proposal",
    "reject-profile-version-bump",
    "reject-boundary-overclaim",
    "reject-source-manifest-hash-drift"
  ],
  "boundary": {
    "attests": [
      "w4-7-profile-growth-batch-proposal",
      "m2-evidence-reviewed-for-l2-l3-admission",
      "zero-l2-l3-profile-changes-proposed",
      "profile-v0-kept",
      "demand-gated-candidates-remain-parked",
      "next-work-shifts-to-reduced-origin-foundation"
    ],
    "excludes": [
      "implemented-profile-expansion",
      "profile-version-bump",
      "new-profile-builtin",
      "new-meaning-graph-node",
      "new-datum-kind",
      "synthetic-demand-evidence",
      "semantic-equivalence",
      "policy-correctness",
      "external-independent-verification",
      "receipt-authenticity",
      "m3c-graph-evaluation-independence",
      "m3d-source-lowering-independence"
    ]
  }
}
